<?xml version="1.0" encoding="UTF-8" standalone="no"?>
<schema version="0.3" xmlns:xsi="http://www.w3.org/2001/XMLSchema-instance" xsi:noNamespaceSchemaLocation="xmlschema03.xsd">
<!--
/**
 * XML from Yapeal.
 *
 * PHP version 5
 *
 * LICENSE: This file is part of Yet Another Php Eve Api library also know
 * as Yapeal which will be used to refer to it in the rest of this license.
 *
 *  Yapeal is free software: you can redistribute it and/or modify
 *  it under the terms of the GNU Lesser General Public License as published by
 *  the Free Software Foundation, either version 3 of the License, or
 *  (at your option) any later version.
 *
 *  Yapeal is distributed in the hope that it will be useful,
 *  but WITHOUT ANY WARRANTY; without even the implied warranty of
 *  MERCHANTABILITY or FITNESS FOR A PARTICULAR PURPOSE.  See the
 *  GNU Lesser General Public License for more details.
 *
 *  You should have received a copy of the GNU Lesser General Public License
 *  along with Yapeal. If not, see <http://www.gnu.org/licenses/>.
 *
 * @author     Michael Cummings <mgcummings@yahoo.com>
 * @copyright  Copyright (c) 2008-2012, Michael Cummings
 * @license    http://www.gnu.org/copyleft/lesser.html GNU LGPL
 * @package    Yapeal
 * @subpackage Install
 * @link       http://code.google.com/p/yapeal/
 * @link       http://www.eveonline.com/
 */
-->
  <!-- Account Section -->
  <table name="accountAccountStatus">
    <field name="`keyID`" type="I8" size="20">
      <KEY/>
      <UNSIGNED/>
    </field>
    <field name="`createDate`" type="T">
      <NOTNULL/>
    </field>
    <field name="`logonCount`" type="I8" size="20">
      <NOTNULL/>
      <UNSIGNED/>
    </field>
    <field name="`logonMinutes`" type="I8" size="20">
      <NOTNULL/>
      <UNSIGNED/>
    </field>
    <field name="`paidUntil`" type="T">
      <NOTNULL/>
    </field>
    <opt platform="mysql"> ENGINE = InnoDB COLLATE = utf8_unicode_ci</opt>
  </table>
  <table name="accountAPIKeyInfo">
    <field name="`keyID`" type="I8" size="20">
      <KEY/>
      <UNSIGNED/>
    </field>
    <field name="`accessMask`" type="I8" size="20">
      <NOTNULL/>
      <UNSIGNED/>
    </field>
    <field name="`expires`" type="T">
      <NOTNULL/>
      <DEFAULT value="2038-01-19 03:14:07"/>
    </field>
    <field name="`type`" type="C" size="11">
      <NOTNULL/>
    </field>
    <index name="`accountAPIKeyInfo1`">
      <col>`type`</col>
    </index>
    <opt platform="mysql"> ENGINE = InnoDB COLLATE = utf8_unicode_ci</opt>
  </table>
  <table name="accountCharacters">
    <field name="`characterID`" type="I8" size="20">
      <KEY/>
      <UNSIGNED/>
    </field>
    <field name="`characterName`" type="C" size="255">
      <NOTNULL/>
    </field>
    <field name="`corporationID`" type="I8" size="20">
      <NOTNULL/>
      <UNSIGNED/>
    </field>
    <field name="`corporationName`" type="C" size="255">
      <NOTNULL/>
    </field>
    <index name="`accountCharacters1`">
      <col>`corporationID`</col>
    </index>
    <opt platform="mysql"> ENGINE = InnoDB COLLATE = utf8_unicode_ci</opt>
  </table>
  <table name="accountKeyBridge">
    <field name="`keyID`" type="I8" size="20">
      <KEY/>
      <UNSIGNED/>
    </field>
    <field name="`characterID`" type="I8" size="20">
      <KEY/>
      <UNSIGNED/>
    </field>
    <index name="`accountKeyBridge1`">
      <col>`characterID`</col>
      <col>`keyID`</col>
      <UNIQUE/>
    </index>
    <opt platform="mysql"> ENGINE = InnoDB COLLATE = utf8_unicode_ci</opt>
  </table>
  <sql prefixmethod="MANUAL">
    <query platform="mysql">ALTER TABLE `%%PaccountAPIKeyInfo` MODIFY `type` ENUM('Account','Character','Corporation') COLLATE ascii_general_ci NOT NULL</query>
  </sql>
  <sql prefixmethod="MANUAL">
    <query platform="mysql">INSERT INTO `%%PutilSections` (`activeAPIMask`,`isActive`,`sectionID`,`section`)
      VALUES(33554433,1,1,'account')
      ON DUPLICATE KEY UPDATE `activeAPIMask`=VALUES(`activeAPIMask`),`sectionID`=VALUES(`sectionID`),`section`=VALUES(`section`)
    </query>
  </sql>
</schema>
