<?xml version="1.0" encoding="UTF-8" standalone="no"?>
<schema version="0.3" xmlns:xsi="http://www.w3.org/2001/XMLSchema-instance" xsi:noNamespaceSchemaLocation="xmlschema03.xsd">
<!--
/**
 * XML from Yapeal.
 *
 * PHP version 5
 *
 * LICENSE: This file is part of Yet Another Php Eve Api library also know
 * as Yapeal which will be used to refer to it in the rest of this license.
 *
 *  Yapeal is free software: you can redistribute it and/or modify
 *  it under the terms of the GNU Lesser General Public License as published by
 *  the Free Software Foundation, either version 3 of the License, or
 *  (at your option) any later version.
 *
 *  Yapeal is distributed in the hope that it will be useful,
 *  but WITHOUT ANY WARRANTY; without even the implied warranty of
 *  MERCHANTABILITY or FITNESS FOR A PARTICULAR PURPOSE.  See the
 *  GNU Lesser General Public License for more details.
 *
 *  You should have received a copy of the GNU Lesser General Public License
 *  along with Yapeal. If not, see <http://www.gnu.org/licenses/>.
 *
 * @author     Michael Cummings <mgcummings@yahoo.com>
 * @copyright  Copyright (c) 2008-2012, Michael Cummings
 * @license    http://www.gnu.org/copyleft/lesser.html GNU LGPL
 * @package    Yapeal
 * @subpackage Install
 * @link       http://code.google.com/p/yapeal/
 * @link       http://www.eveonline.com/
 */
-->
  <!-- Server Section -->
  <table name="serverServerStatus">
    <field name="`onlinePlayers`" type="I8" size="20">
      <NOTNULL/>
      <UNSIGNED/>
    </field>
    <field name="`serverName`" type="C" size="32">
      <KEY/>
    </field>
    <field name="`serverOpen`" type="C" size="32">
      <NOTNULL/>
    </field>
    <opt platform="mysql"> ENGINE = InnoDB COLLATE = utf8_unicode_ci</opt>
  </table>
  <sql prefixmethod="MANUAL">
    <query platform="mysql">INSERT INTO `%%PutilSections` (`activeAPIMask`,`isActive`,`sectionID`,`section`)
      VALUES(1,1,6,'server')
      ON DUPLICATE KEY UPDATE `activeAPIMask`=VALUES(`activeAPIMask`),`sectionID`=VALUES(`sectionID`),`section`=VALUES(`section`)
    </query>
  </sql>
</schema>
